{"$schema":"https://json-schema.org/draft/2020-12/schema","$id":"https://chatgpt-lib.local/commands/record_viewing_feedback.schema.json","type":"object","additionalProperties":false,"required":["schema_version","operation_id","operation","work_ref","target_updates"],"properties":{"schema_version":{"const":1},"operation_id":{"type":"string","minLength":36,"maxLength":36},"operation":{"const":"record_viewing_feedback"},"work_ref":{"$ref":"https://chatgpt-lib.local/commands/common.schema.json#/$defs/workRef"},"create_if_missing":{"type":"boolean","default":false},"target_updates":{"type":"array","minItems":1,"items":{"$ref":"https://chatgpt-lib.local/commands/common.schema.json#/$defs/targetUpdate"}}}}
