{
  "schema_version": 1,
  "operation_id": "6f2b8de8-6d2f-4e96-8cf4-5f01c1cd80df",
  "operation": "record_viewing_feedback",
  "work_ref": {
    "title": "Masters of the Universe",
    "year": 2026
  },
  "create_if_missing": true,
  "target_updates": [
    {
      "target": "primary",
      "viewing": {
        "status": "watched"
      },
      "rating": {
        "score": 6,
        "source": "explicit",
        "confidence": "exact"
      },
      "reaction": {
        "value": "mixed",
        "source": "inferred",
        "confidence": "high"
      },
      "feedback": {
        "summary": "Приятная картинка, но фильм очень детский; один раз посмотреть фоном сойдёт.",
        "signals": [
          {
            "term": "visuals.strong",
            "sentiment": "positive",
            "strength": 2,
            "source": "explicit",
            "confidence": "high"
          }
        ]
      }
    },
    {
      "target": "partner",
      "reaction": {
        "value": "mixed",
        "source": "inferred",
        "confidence": "high"
      },
      "feedback": {
        "summary": "В целом того же мнения: приятная картинка, но фильм очень детский и годится скорее для одноразового фонового просмотра.",
        "signals": [
          {
            "term": "visuals.strong",
            "sentiment": "positive",
            "strength": 2,
            "source": "explicit",
            "confidence": "high"
          }
        ]
      }
    }
  ]
}
