{
  "schema_version": 1,
  "operation_id": "c4e8f2d1-5a7b-4c3e-9f10-2d6a8b4c7e91",
  "operation": "record_viewing_feedback",
  "work_ref": {
    "id": "deja-vu-2006"
  },
  "target_updates": [
    {
      "target": "partner",
      "viewing": {
        "status": "watched"
      },
      "rating": {
        "score": 8,
        "source": "explicit",
        "confidence": "exact"
      },
      "feedback": {
        "summary": "Прикольный и интересный фильм, есть над чем задуматься. Ничего не поняла, но ей нравится, когда не всё понятно и муж потом объясняет. Жаль, что фильм мало собрал в прокате.",
        "signals": [
          {
            "term": "entertainment.engaging",
            "sentiment": "positive",
            "strength": 2,
            "source": "explicit",
            "confidence": "high"
          }
        ]
      }
    },
    {
      "target": "primary",
      "viewing": {
        "status": "watched"
      },
      "rating": {
        "score": 7.5,
        "source": "explicit",
        "confidence": "exact"
      },
      "feedback": {
        "summary": "Интересный фильм с хорошо продуманным сюжетом и замкнутой временной петлёй. Возможно, уже смотрел его раньше, но был не против посмотреть снова. Снизил балл за моменты, где глупость двигает сюжет, и за визуальную стилистику, которая не впечатлила. В целом неплох для совместного просмотра.",
        "signals": [
          {
            "term": "entertainment.engaging",
            "sentiment": "positive",
            "strength": 2,
            "source": "explicit",
            "confidence": "high"
          },
          {
            "term": "story.logic",
            "sentiment": "mixed",
            "strength": 2,
            "source": "explicit",
            "confidence": "high"
          },
          {
            "term": "narrative.time_loop",
            "sentiment": "positive",
            "strength": 2,
            "source": "explicit",
            "confidence": "high"
          },
          {
            "term": "visuals.strong",
            "sentiment": "negative",
            "strength": 1,
            "source": "explicit",
            "confidence": "high"
          }
        ]
      }
    }
  ]
}
